{
  "policy_id": "wtp_demo_001",
  "schema_version": "0.3.0",
  "policy_version": 1,
  "issued_at": "2026-08-27T17:00:00Z",
  "keys": [
    {
      "key_id": "witness_ed25519_001",
      "algorithm": "Ed25519",
      "witness_domain": "independent_evidence_domain",
      "public_key_sha256": "sha256:0000000000000000000000000000000000000000000000000000000000000000",
      "status": "active",
      "valid_from": "2026-08-27T17:00:00Z",
      "valid_until": "2027-08-27T17:00:00Z",
      "revoked_at": null,
      "revocation_mode": "none"
    }
  ]
}
